{
 "contract_version": "1.0",
 "correlation_identifier": "DOCUMENT-RESERVATION-CERTIFICATE@8f6a21595ee24e80753a00d56504ba39cf7e9f0df1b559b4569d0f4479264ee5",
 "document": {
 "actions": [],
 "attachments": [],
 "audience": [
 "applicant",
 "reservation-authority"
 ],
 "definition_identifier": "DOCUMENT-RESERVATION-CERTIFICATE",
 "definition_revision": 1,
 "evidence": [
 {
 "artifact_identifier": "ARTIFACT-APPLICATION-000001",
 "artifact_revision": 1,
 "artifact_type": "Application",
 "payload_path": null,
 "source_reference": "business/profiles/property-reservation/examples/artifacts/application-000001-r1.yaml",
 "subject_identifier": "RESERVATION-000001"
 },
 {
 "artifact_identifier": "ARTIFACT-RECEIPT-000001",
 "artifact_revision": 1,
 "artifact_type": "Receipt",
 "payload_path": null,
 "source_reference": "business/profiles/property-reservation/examples/artifacts/receipt-000001-r1.yaml",
 "subject_identifier": "RESERVATION-000001"
 },
 {
 "artifact_identifier": "ARTIFACT-RESERVATION-CERTIFICATE-000001",
 "artifact_revision": 1,
 "artifact_type": "ReservationCertificate",
 "payload_path": null,
 "source_reference": "business/profiles/property-reservation/examples/artifacts/reservation-certificate-000001-r1.yaml",
 "subject_identifier": "RESERVATION-000001"
 }
 ],
 "identifier": "DOCUMENT-RESERVATION-CERTIFICATE@8f6a21595ee24e80753a00d56504ba39cf7e9f0df1b559b4569d0f4479264ee5",
 "metadata": {
 "definition_source_fingerprint": "329a7f5a2777e8f2f8ad6cdd47346f32e93a493e9a55b7f6d33d26e2df1fce62",
 "selected_evidence_count": 3
 },
 "primary_artifact": {
 "identifier": "ARTIFACT-RESERVATION-CERTIFICATE-000001",
 "revision": 1,
 "source_reference": "business/profiles/property-reservation/examples/artifacts/reservation-certificate-000001-r1.yaml",
 "type": "ReservationCertificate"
 },
 "resolution_fingerprint": "8f6a21595ee24e80753a00d56504ba39cf7e9f0df1b559b4569d0f4479264ee5",
 "sections": [
 {
 "fields": [
 {
 "evidence": [
 {
 "artifact_identifier": "ARTIFACT-APPLICATION-000001",
 "artifact_revision": 1,
 "artifact_type": "Application",
 "payload_path": "payload.applicant_alias",
 "source_reference": "business/profiles/property-reservation/examples/artifacts/application-000001-r1.yaml",
 "subject_identifier": "RESERVATION-000001"
 }
 ],
 "identifier": "applicant_alias",
 "label": "Applicant",
 "metadata": {},
 "value": {
 "type": "string",
 "value": "Ana Example"
 }
 },
 {
 "evidence": [
 {
 "artifact_identifier": "ARTIFACT-RESERVATION-CERTIFICATE-000001",
 "artifact_revision": 1,
 "artifact_type": "ReservationCertificate",
 "payload_path": "payload.lot_identifier",
 "source_reference": "business/profiles/property-reservation/examples/artifacts/reservation-certificate-000001-r1.yaml",
 "subject_identifier": "RESERVATION-000001"
 }
 ],
 "identifier": "lot_identifier",
 "label": "Reserved property",
 "metadata": {},
 "value": {
 "type": "string",
 "value": "LOT-037"
 }
 },
 {
 "evidence": [
 {
 "artifact_identifier": "ARTIFACT-RECEIPT-000001",
 "artifact_revision": 1,
 "artifact_type": "Receipt",
 "payload_path": "payload.amount",
 "source_reference": "business/profiles/property-reservation/examples/artifacts/receipt-000001-r1.yaml",
 "subject_identifier": "RESERVATION-000001"
 }
 ],
 "identifier": "receipt_amount",
 "label": "Accepted reservation payment",
 "metadata": {},
 "value": {
 "type": "integer",
 "value": 50000
 }
 }
 ],
 "identifier": "certificate",
 "title": "Certified Reservation"
 }
 ],
 "status": "accepted",
 "subject": {
 "identifier": "RESERVATION-000001",
 "type": "PropertyReservation"
 },
 "title": "Reservation Certificate"
 },
 "options": {
 "include_evidence": true
 },
 "request_fingerprint": "c0314c87b9706c19140c6010a0b303a5d966fd3489fe2d460b7fa6275682508b",
 "request_identifier": "XDOC-REQUEST@c0314c87b9706c19140c6010a0b303a5d966fd3489fe2d460b7fa6275682508b",
 "requested_capabilities": [
 "actions",
 "attachments",
 "evidence"
 ],
 "requested_driver": "json"
}
